{
  "name": "RWG Sepolia Custom Tokens",
  "logoURI": "https://token-sale-portal.vercel.app/logo-1.png",
  "version": {
    "major": 1,
    "minor": 0,
    "patch": 0
  },
  "keywords": ["rwg", "real world gaming", "$REAL"],
  "timestamp": "2025-04-01T00:00:00+00:00",
  "tokens": [
    {
      "chainId": 11155111,
      "address": "0x6a0d40eeaef86b1e4356e8b17e190e36cba04298",
      "name": "Testnet USDC",
      "symbol": "USDC",
      "decimals": 18,
      "logoURI": "https://cryptologos.cc/logos/usd-coin-usdc-logo.png?v=040"
    }
  ]
}
